{
  "version": "2.0",
  "resumen": {
    "encuestas": 3,
    "carreras": 3,
    "facultades": 3,
    "fecha_inicio": "2026-09-22",
    "fecha_fin": "2026-09-22",
    "dias": 1,
    "dias_recoleccion": 1,
    "año": 2026,
    "periodo": "2026-2",
    "nps": {
      "score": 100.0,
      "promotores": 3,
      "pasivos": 0,
      "detractores": 0,
      "total": 3
    },
    "csat": {
      "score": 66.67,
      "t3b": 2,
      "total": 3,
      "t2b": 2,
      "t2b_pct": 66.67,
      "ponderado": 73.33333333333333
    }
  },
  "hallazgos": {
    "csat_pct": 66,
    "nps_score": 100,
    "nps_tipo": "Excelente",
    "nps_etapas": {},
    "tendencia": "se mantiene",
    "delta": 0,
    "top_dimensiones": [
      {
        "name": "Cursos del programa y contenidos",
        "score": 66.67
      },
      {
        "name": "Calidad de la enseñanza en la carrera",
        "score": 66.67
      }
    ],
    "top_facultades": [
      {
        "name": "Facultad de Derecho",
        "score": 100.0
      },
      {
        "name": "Facultad de Psicología",
        "score": 100.0
      }
    ]
  },
  "nps": {
    "promotores": 3,
    "pasivos": 0,
    "detractores": 0,
    "score": 100.0
  },
  "csat": {
    "Totalmente satisfecho": 2,
    "Muy satisfecho": 0,
    "Satisfecho": 0,
    "Insatisfecho": 0,
    "Totalmente insatisfecho": 1,
    "No utilizo": 0,
    "No conozco": 0
  },
  "_export": {
    "nombre_encuesta": "encuesta_de_satisfacción_estudiantil_pregrado_2026_2",
    "fecha_generacion": "2026-09-22"
  }
}