{
  "version": "2.1",
  "resumen": {
    "encuestas": 1,
    "carreras": 1,
    "facultades": 1,
    "fecha_inicio": "2026-10-03",
    "fecha_fin": "2026-10-03",
    "dias": 1,
    "dias_recoleccion": 1,
    "año": 2026,
    "periodo": "2026",
    "nps": {
      "score": 100.0,
      "promotores": 1,
      "pasivos": 0,
      "detractores": 0,
      "total": 1
    },
    "csat": {
      "score": 100.0,
      "t3b": 1,
      "total": 1,
      "t2b": 1,
      "t2b_pct": 100.0,
      "ponderado": 100.0
    }
  },
  "hallazgos": {
    "csat_pct": 100,
    "nps_score": 100,
    "nps_tipo": "Excelente",
    "nps_etapas": {},
    "tendencia": "se mantiene",
    "delta": 0,
    "top_dimensiones": [
      {
        "name": "Organización del puesto de trabajo",
        "score": 100.0
      },
      {
        "name": "Claridad de funciones y responsabilidades",
        "score": 100.0
      }
    ],
    "top_facultades": [
      {
        "name": "Otra",
        "score": 100.0
      }
    ]
  },
  "nps": {
    "promotores": 1,
    "pasivos": 0,
    "detractores": 0,
    "score": 100.0
  },
  "csat": {
    "Totalmente satisfecho": 1,
    "Muy satisfecho": 0,
    "Satisfecho": 0,
    "Insatisfecho": 0,
    "Totalmente insatisfecho": 0,
    "No utilizo": 0,
    "No conozco": 0
  },
  "_export": {
    "nombre_encuesta": "encuesta_de_satisfacción_no_docente_2026",
    "fecha_generacion": "2026-10-03"
  },
  "preguntas": [
    {
      "id": "nps",
      "nombre": "Recomendación (0 al 10)",
      "tipo": "medida",
      "escala": "NPS"
    },
    {
      "id": "carrera",
      "nombre": "Dependencia",
      "tipo": "agrupacion",
      "escala": ""
    },
    {
      "id": "nd_antiguedad",
      "nombre": "Años en la Universidad",
      "tipo": "agrupacion",
      "escala": ""
    },
    {
      "id": "nd_organizacion_puesto",
      "nombre": "Organización del puesto de trabajo",
      "tipo": "medida",
      "escala": "CSAT"
    },
    {
      "id": "nd_claridad_funciones",
      "nombre": "Claridad de funciones y responsabilidades",
      "tipo": "medida",
      "escala": "CSAT"
    },
    {
      "id": "nd_carga_laboral",
      "nombre": "Distribución de la carga laboral",
      "tipo": "medida",
      "escala": "CSAT"
    },
    {
      "id": "nd_liderazgo",
      "nombre": "Liderazgo y compromiso de la jefatura",
      "tipo": "medida",
      "escala": "CSAT"
    },
    {
      "id": "nd_comunicacion_jefatura",
      "nombre": "Comunicación de la jefatura",
      "tipo": "medida",
      "escala": "CSAT"
    },
    {
      "id": "nd_mecanismos_comunicacion",
      "nombre": "Mecanismos de comunicación y coordinación",
      "tipo": "medida",
      "escala": "CSAT"
    },
    {
      "id": "nd_solucion_problemas",
      "nombre": "Solución de problemas",
      "tipo": "medida",
      "escala": "CSAT"
    },
    {
      "id": "nd_trabajo_equipo",
      "nombre": "Trabajo en equipo",
      "tipo": "medida",
      "escala": "CSAT"
    },
    {
      "id": "nd_comunicacion_companeros",
      "nombre": "Comunicación con compañeros",
      "tipo": "medida",
      "escala": "CSAT"
    },
    {
      "id": "nd_coordinacion_dependencias",
      "nombre": "Coordinación con otras dependencias",
      "tipo": "medida",
      "escala": "CSAT"
    },
    {
      "id": "nd_motivacion",
      "nombre": "Motivación para aportar ideas",
      "tipo": "medida",
      "escala": "CSAT"
    },
    {
      "id": "nd_clima_laboral",
      "nombre": "Clima laboral",
      "tipo": "medida",
      "escala": "CSAT"
    },
    {
      "id": "nd_promocion_reconocimiento",
      "nombre": "Promoción y reconocimiento",
      "tipo": "medida",
      "escala": "CSAT"
    },
    {
      "id": "nd_retroalimentacion",
      "nombre": "Retroalimentación del desempeño",
      "tipo": "medida",
      "escala": "CSAT"
    },
    {
      "id": "nd_becas",
      "nombre": "Programa de becas internas",
      "tipo": "medida",
      "escala": "CSAT"
    },
    {
      "id": "nd_capacitacion",
      "nombre": "Programas de capacitación",
      "tipo": "medida",
      "escala": "CSAT"
    },
    {
      "id": "nd_servicio_medico",
      "nombre": "Servicio médico y su infraestructura",
      "tipo": "medida",
      "escala": "CSAT"
    },
    {
      "id": "nd_talleres",
      "nombre": "Talleres artísticos y culturales",
      "tipo": "medida",
      "escala": "CSAT"
    },
    {
      "id": "nd_actividades_deportivas",
      "nombre": "Actividades deportivas",
      "tipo": "medida",
      "escala": "CSAT"
    },
    {
      "id": "nd_instalaciones_sociales",
      "nombre": "Instalaciones para relación social",
      "tipo": "medida",
      "escala": "CSAT"
    },
    {
      "id": "nd_oficinas",
      "nombre": "Oficinas o cubículos",
      "tipo": "medida",
      "escala": "CSAT"
    },
    {
      "id": "nd_software",
      "nombre": "Software especializado",
      "tipo": "medida",
      "escala": "CSAT"
    },
    {
      "id": "nd_portal_mi_ulima",
      "nombre": "Portal web (Mi Ulima)",
      "tipo": "medida",
      "escala": "CSAT"
    },
    {
      "id": "nd_aula_virtual",
      "nombre": "Aula virtual",
      "tipo": "medida",
      "escala": "CSAT"
    },
    {
      "id": "nd_conexion_wifi",
      "nombre": "Conexión Wi-Fi",
      "tipo": "medida",
      "escala": "CSAT"
    },
    {
      "id": "nd_soporte_tecnico",
      "nombre": "Soporte técnico",
      "tipo": "medida",
      "escala": "CSAT"
    },
    {
      "id": "csat_sujeto",
      "nombre": "Satisfacción con tu dependencia",
      "tipo": "medida",
      "escala": "CSAT"
    },
    {
      "id": "csat_universidad",
      "nombre": "Satisfacción con la Universidad",
      "tipo": "medida",
      "escala": "CSAT"
    },
    {
      "id": "ciclo",
      "nombre": "Ciclo",
      "tipo": "agrupacion",
      "escala": ""
    },
    {
      "id": "facultad",
      "nombre": "Facultad",
      "tipo": "agrupacion",
      "escala": ""
    }
  ]
}