{
  "version": "2.0",
  "resumen": {
    "encuestas": 598,
    "carreras": 12,
    "facultades": 7,
    "fecha_inicio": "2026-04-16",
    "fecha_fin": "2026-08-14",
    "dias": 121,
    "dias_recoleccion": 19,
    "año": 2026,
    "periodo": "2026",
    "nps": {
      "score": 85.62,
      "promotores": 523,
      "pasivos": 64,
      "detractores": 11,
      "total": 598
    },
    "csat": {
      "score": 99.0,
      "t3b": 592,
      "total": 598,
      "t2b": 491,
      "t2b_pct": 82.11,
      "ponderado": 87.52508361204013
    },
    "empleabilidad": {
      "score": 87.29,
      "empleados": 522,
      "total": 598
    }
  },
  "hallazgos": {
    "csat_pct": 99,
    "nps_score": 85,
    "nps_tipo": "Excelente",
    "nps_etapas": {},
    "tendencia": "se mantiene",
    "delta": 0,
    "top_dimensiones": [
      {
        "name": "Metodologías",
        "score": 99.5
      },
      {
        "name": "Condiciones ambientales en laboratorios",
        "score": 99.43
      }
    ],
    "top_facultades": [
      {
        "name": "Facultad de Arquitectura",
        "score": 100.0
      },
      {
        "name": "Facultad de Derecho",
        "score": 100.0
      }
    ]
  },
  "nps": {
    "promotores": 523,
    "pasivos": 64,
    "detractores": 11,
    "score": 85.62
  },
  "csat": {
    "Totalmente satisfecho": 338,
    "Muy satisfecho": 153,
    "Satisfecho": 101,
    "Insatisfecho": 6,
    "Totalmente insatisfecho": 0,
    "No utilizo": 0,
    "No conozco": 0
  },
  "_export": {
    "nombre_encuesta": "encuesta_de_satisfacción_graduados_pregrado_2026",
    "fecha_generacion": "2026-10-02"
  },
  "preguntas": [
    {
      "id": "nps",
      "nombre": "Recomiendas la Universidad de Lima",
      "tipo": "medida",
      "escala": "NPS"
    },
    {
      "id": "carrera",
      "nombre": "Carrera",
      "tipo": "agrupacion",
      "escala": ""
    },
    {
      "id": "situacion_laboral",
      "nombre": "Situación laboral",
      "tipo": "agrupacion",
      "escala": ""
    },
    {
      "id": "tiempo_laboral",
      "nombre": "Tiempo laboral",
      "tipo": "agrupacion",
      "escala": ""
    },
    {
      "id": "perfil_del_egreso_de_la_carrera",
      "nombre": "Perfil del egreso de la carrera",
      "tipo": "medida",
      "escala": "CSAT"
    },
    {
      "id": "plan_curricular_y_perfil_de_egreso",
      "nombre": "Plan curricular y perfil de egreso",
      "tipo": "medida",
      "escala": "CSAT"
    },
    {
      "id": "cursos_del_programa_y_contenidos",
      "nombre": "Cursos del programa y contenidos",
      "tipo": "medida",
      "escala": "CSAT"
    },
    {
      "id": "calidad_de_la_ensenanza_en_la_carrera",
      "nombre": "Calidad de la enseñanza en la carrera",
      "tipo": "medida",
      "escala": "CSAT"
    },
    {
      "id": "claridad_de_los_recursos_academicos",
      "nombre": "Claridad de los recursos académicos",
      "tipo": "medida",
      "escala": "CSAT"
    },
    {
      "id": "calidad_de_la_formacion_academica",
      "nombre": "Calidad de la formación académica",
      "tipo": "medida",
      "escala": "CSAT"
    },
    {
      "id": "exigencia_academica",
      "nombre": "Exigencia académica",
      "tipo": "medida",
      "escala": "CSAT"
    },
    {
      "id": "evaluacion_del_aprendizaje",
      "nombre": "Evaluación del aprendizaje",
      "tipo": "medida",
      "escala": "CSAT"
    },
    {
      "id": "intercambio_estudiantil",
      "nombre": "Intercambio estudiantil",
      "tipo": "medida",
      "escala": "CSAT"
    },
    {
      "id": "transmision_de_conocimientos",
      "nombre": "Transmisión de conocimientos",
      "tipo": "medida",
      "escala": "CSAT"
    },
    {
      "id": "transmision_de_experiencias",
      "nombre": "Transmisión de experiencias",
      "tipo": "medida",
      "escala": "CSAT"
    },
    {
      "id": "metodologias",
      "nombre": "Metodologías",
      "tipo": "medida",
      "escala": "CSAT"
    },
    {
      "id": "conocimientos_actualizados",
      "nombre": "Conocimientos actualizados",
      "tipo": "medida",
      "escala": "CSAT"
    },
    {
      "id": "compromiso",
      "nombre": "Compromiso",
      "tipo": "medida",
      "escala": "CSAT"
    },
    {
      "id": "retroalimentacion",
      "nombre": "Retroalimentación",
      "tipo": "medida",
      "escala": "CSAT"
    },
    {
      "id": "disponibilidad_para_asesorias",
      "nombre": "Disponibilidad para asesorías",
      "tipo": "medida",
      "escala": "CSAT"
    },
    {
      "id": "cumplimiento_de_normas_y_programas",
      "nombre": "Cumplimiento de normas y programas",
      "tipo": "medida",
      "escala": "CSAT"
    },
    {
      "id": "habilidades_para_trabajar_en_equipo",
      "nombre": "Habilidades para trabajar en equipo",
      "tipo": "medida",
      "escala": "CSAT"
    },
    {
      "id": "habilidades_de_comunicacion",
      "nombre": "Habilidades de comunicación",
      "tipo": "medida",
      "escala": "CSAT"
    },
    {
      "id": "habilidades_para_aportar_nuevas_ideas",
      "nombre": "Habilidades para aportar nuevas ideas",
      "tipo": "medida",
      "escala": "CSAT"
    },
    {
      "id": "mejora_en_perspectivas_de_empleo",
      "nombre": "Mejora en perspectivas de empleo",
      "tipo": "medida",
      "escala": "CSAT"
    },
    {
      "id": "informacion_sobre_el_record_academico",
      "nombre": "Información sobre el récord académico",
      "tipo": "medida",
      "escala": "CSAT"
    },
    {
      "id": "material_bibliografico_en_la_biblioteca",
      "nombre": "Material bibliográfico en la biblioteca",
      "tipo": "medida",
      "escala": "CSAT"
    },
    {
      "id": "atencion_del_personal_administrativo",
      "nombre": "Atención del personal administrativo",
      "tipo": "medida",
      "escala": "CSAT"
    },
    {
      "id": "procedimientos_administrativos",
      "nombre": "Procedimientos administrativos",
      "tipo": "medida",
      "escala": "CSAT"
    },
    {
      "id": "ayuda_financiera",
      "nombre": "Ayuda financiera",
      "tipo": "medida",
      "escala": "CSAT"
    },
    {
      "id": "servicio_medico_y_su_infraestructura",
      "nombre": "Servicio médico y su infraestructura",
      "tipo": "medida",
      "escala": "CSAT"
    },
    {
      "id": "servicio_de_atencion_psicopedagogica",
      "nombre": "Servicio de atención psicopedagógica",
      "tipo": "medida",
      "escala": "CSAT"
    },
    {
      "id": "talleres_de_actividades_artisticas_y_culturales",
      "nombre": "Talleres de actividades artísticas y culturales",
      "tipo": "medida",
      "escala": "CSAT"
    },
    {
      "id": "actividades_deportivas",
      "nombre": "Actividades deportivas",
      "tipo": "medida",
      "escala": "CSAT"
    },
    {
      "id": "empleabilidad_vinculacion_y_alumni",
      "nombre": "Empleabilidad, vinculación y ALUMNI",
      "tipo": "medida",
      "escala": "CSAT"
    },
    {
      "id": "aulas_de_clase",
      "nombre": "Aulas de clase",
      "tipo": "medida",
      "escala": "CSAT"
    },
    {
      "id": "ambientes_y_salas_para_estudio",
      "nombre": "Ambientes y salas para estudio",
      "tipo": "medida",
      "escala": "CSAT"
    },
    {
      "id": "equipamiento_tecnologico_en_laboratorios",
      "nombre": "Equipamiento tecnológico en laboratorios",
      "tipo": "medida",
      "escala": "CSAT"
    },
    {
      "id": "condiciones_ambientales_en_laboratorios",
      "nombre": "Condiciones ambientales en laboratorios",
      "tipo": "medida",
      "escala": "CSAT"
    },
    {
      "id": "software_especializado_empleado_en_la_carrera",
      "nombre": "Software especializado empleado en la carrera",
      "tipo": "medida",
      "escala": "CSAT"
    },
    {
      "id": "portal_web_de_la_universidad_mi_ulima",
      "nombre": "Portal web de la Universidad (Mi Ulima)",
      "tipo": "medida",
      "escala": "CSAT"
    },
    {
      "id": "aula_virtual",
      "nombre": "Aula virtual",
      "tipo": "medida",
      "escala": "CSAT"
    },
    {
      "id": "conexion_wi_fi_en_el_campus",
      "nombre": "Conexión Wi-Fi en el campus",
      "tipo": "medida",
      "escala": "CSAT"
    },
    {
      "id": "soporte_tecnico_del_sistema_informatico",
      "nombre": "Soporte técnico del sistema informático",
      "tipo": "medida",
      "escala": "CSAT"
    },
    {
      "id": "csat_sujeto",
      "nombre": "La carrera",
      "tipo": "medida",
      "escala": "CSAT"
    },
    {
      "id": "csat_universidad",
      "nombre": "La Universidad de Lima",
      "tipo": "medida",
      "escala": "CSAT"
    },
    {
      "id": "ciclo",
      "nombre": "Ciclo",
      "tipo": "agrupacion",
      "escala": ""
    },
    {
      "id": "facultad",
      "nombre": "Facultad",
      "tipo": "agrupacion",
      "escala": ""
    }
  ]
}